### ISSUE TITLE
DKIM verify failed on the mail from outlook or hotmail

### ISSUE THREAD

**Issue by zhanleewo** [haraka/Haraka#2682]
### system info
OS: Ubuntu 18.04
Nodejs: v8.10.0
Haraka: up to date with master branch

### Expected behavior
DKIM verify failed on the mail from outlook or hotmail.

### Observed behavior
1. Error messages show in console:

```
[DEBUG] [-] [dkim_verify] Found 1 DKIM signatures
[DEBUG] [-] [dkim_verify] @hotmail.com: DKIM fields validated OK
[DEBUG] [-] [dkim_verify] @hotmail.com: a=rsa-sha256 c=relaxed/relaxed h=from,date,subject,message-id,content-type,mime-version,x-ms-exchange-senderadcheck
[DEBUG] [-] [dkim_verify] @hotmail.com: bodyhash=mu8ANU25bkFsa8noeEPTl0nQyccGu1d7DhpHFFP2G20= computed=mu8ANU25bkFsa8noeEPTl0nQyccGu1d7DhpHFFP2G20=
[DEBUG] [-] [dkim_verify] @hotmail.com: canonicalize header: from
[DEBUG] [-] [dkim_verify] @hotmail.com: canonicalize header: date
[DEBUG] [-] [dkim_verify] @hotmail.com: canonicalize header: subject
[DEBUG] [-] [dkim_verify] @hotmail.com: canonicalize header: message-id
[DEBUG] [-] [dkim_verify] @hotmail.com: canonicalize header: content-type
[DEBUG] [-] [dkim_verify] @hotmail.com: canonicalize header: mime-version
[DEBUG] [-] [dkim_verify] @hotmail.com: canonicalize header: x-ms-exchange-senderadcheck
[DEBUG] [-] [dkim_verify] @hotmail.com: DNS lookup selector1._domainkey.hotmail.com (timeout= 29s)
[DEBUG] [-] [dkim_verify] {"identity":"@hotmail.com","selector":"selector1","domain":"hotmail.com","result":"invalid"}
[INFO] [9CBF0FC1-4E66-45EE-9AAF-4A163AF38A2F.1] [dkim_verify] identity="@hotmail.com" domain="hotmail.com" selector="selector1" result=invalid  (no key for signature)
[ERROR] [9CBF0FC1-4E66-45EE-9AAF-4A163AF38A2F.1] [dkim_verify] hotmail.com (no key for signature)
```

2. Packet capture with wireshark:
![QQ图片20190807120823](https://user-images.githubusercontent.com/1725457/62594197-75a31680-b88e-11e9-92fc-7636cc7f73d7.png)

3. Add a break point at line 291 in file dkim.js
```
290 dns.resolveTxt(lookup, (err, res) => {
291     ...
396 }) 

watching the varibles:
err=null
res=[]
```

4. test dns reslove in nodejs
``` 
root@ubuntu:~/Documents/deps/Haraka/aifi# nodejs
const dns    = require('dns');
const lookup = 'selector1._domainKey.hotmail.com';
dns.resolveTxt(lookup, (err, res) => {
    console.log('resolved: ', err, res);
});

output: resolved:  null []

```

### Steps to reproduce
1. Enable dkim_verify
3. Run haraka as an mail server or an open mail exchange
3. send message from hotmail/outlook to haraka mail server

**Comment by zhanleewo** [comment]
@msimerson could you help me to address this issue?

**Comment by msimerson** [comment]
Yes, but it'll likely be a week or so. I've spent the last 6 weeks circumnavigating the lower 48 states (summer holiday with my kids) and we returned two days ago. A few DKIM issues are on my TODO list.

**Comment by zhanleewo** [comment]
I think this is nodejs dns lib's issue.

Because this bug is reduced when I run the dns resolve code in the nodejs's cli directly.

**Comment by analogic** [comment]
@zhanleewo I've just checked incoming mails from hotmail and all are valid DKIMs by Haraka (and RSPAMD)

You should check your DNS if it has no problems with returning long responses to node (once I have identified problem with `dig +noedns ...` command, since node can't do edns). I would also try to upgrade node to 10.*...

**Comment by zhanleewo** [comment]
I have done some tests. I am sure this is an network issue. But it is very strange.

My test env & network topology
![env](https://user-images.githubusercontent.com/1725457/62921804-518a8c80-bddc-11e9-87ed-99abe4192517.png)

It has no problems to resolve `selector1._domainKey.hotmail.com` on the proxy server.
But It has problems to resolve it on the haraka server.

The packet captured on the proxy is blow. I cannot find out any abnormal information.


```
root@USTEXAS02:~/node-v10.16.2-linux-x64# tcpdump -i any tcp and host 8.8.8.8 -s0 -nn -X
tcpdump: verbose output suppressed, use -v or -vv for full protocol decode
listening on any, link-type LINUX_SLL (Linux cooked), capture size 262144 bytes
02:13:08.565615 IP 10.10.10.2.43866 > 8.8.8.8.53: Flags [S], seq 1188297697, win 27600, options [mss 1380,sackOK,TS val 1429019433 ecr 0,nop,wscale 7], length 0
        0x0000:  4500 003c 00ad 4000 4006 15f4 0a0a 0a02  E..<..@.@.......
        0x0010:  0808 0808 ab5a 0035 46d3 fbe1 0000 0000  .....Z.5F.......
        0x0020:  a002 6bd0 59c9 0000 0204 0564 0402 080a  ..k.Y......d....
        0x0030:  552d 1b29 0000 0000 0103 0307            U-.)........
02:13:08.566763 IP 8.8.8.8.53 > 10.10.10.2.43866: Flags [S.], seq 2539140788, ack 1188297698, win 60192, options [mss 1380,sackOK,TS val 2683605095 ecr 1429019433,nop,wscale 8], length 0
        0x0000:  4500 003c 420a 0000 7806 dc96 0808 0808  E..<B...x.......
        0x0010:  0a0a 0a02 0035 ab5a 9758 36b4 46d3 fbe2  .....5.Z.X6.F...
        0x0020:  a012 eb20 dbfd 0000 0204 0564 0402 080a  ...........d....
        0x0030:  9ff4 9067 552d 1b29 0103 0308            ...gU-.)....
02:13:08.752393 IP 10.10.10.2.43866 > 8.8.8.8.53: Flags [.], ack 1, win 216, options [nop,nop,TS val 1429019620 ecr 2683605095], length 0
        0x0000:  4500 0034 00ae 4000 4006 15fb 0a0a 0a02  E..4..@.@.......
        0x0010:  0808 0808 ab5a 0035 46d3 fbe2 9758 36b5  .....Z.5F....X6.
        0x0020:  8010 00d8 f408 0000 0101 080a 552d 1be4  ............U-..
        0x0030:  9ff4 9067                                ...g
02:13:08.752443 IP 10.10.10.2.43866 > 8.8.8.8.53: Flags [P.], seq 1:84, ack 1, win 216, options [nop,nop,TS val 1429019620 ecr 2683605095], length 8312518+ [1au] TXT? selector1._domainkey.outbound.protection.outlook.com. (81)
        0x0000:  4500 0087 00af 4000 4006 15a7 0a0a 0a02  E.....@.@.......
        0x0010:  0808 0808 ab5a 0035 46d3 fbe2 9758 36b5  .....Z.5F....X6.
        0x0020:  8018 00d8 36cb 0000 0101 080a 552d 1be4  ....6.......U-..
        0x0030:  9ff4 9067 0051 30e6 0100 0001 0000 0000  ...g.Q0.........
        0x0040:  0001 0973 656c 6563 746f 7231 0a5f 646f  ...selector1._do
        0x0050:  6d61 696e 6b65 7908 6f75 7462 6f75 6e64  mainkey.outbound
        0x0060:  0a70 726f 7465 6374 696f 6e07 6f75 746c  .protection.outl
        0x0070:  6f6f 6b03 636f 6d00 0010 0001 0000 2902  ook.com.......).
        0x0080:  0000 0000 0000 00                        .......
02:13:08.753689 IP 8.8.8.8.53 > 10.10.10.2.43866: Flags [.], ack 84, win 236, options [nop,nop,TS val 2683605281 ecr 1429019620], length 0
        0x0000:  4500 0034 4263 0000 7806 dc45 0808 0808  E..4Bc..x..E....
        0x0010:  0a0a 0a02 0035 ab5a 9758 36b5 46d3 fc35  .....5.Z.X6.F..5
        0x0020:  8010 00ec f2e7 0000 0101 080a 9ff4 9121  ...............!
        0x0030:  552d 1be4                                U-..
02:13:08.760277 IP 8.8.8.8.53 > 10.10.10.2.43866: Flags [P.], seq 1:535, ack 84, win 236, options [nop,nop,TS val 2683605288 ecr 1429019620], length 53412518 1/0/1 TXT "v=DKIM1;k=rsa;p=MIIBIjANBgkqhkiG9w0BAQEFAAOCAQ8AMIIBCgKCAQEAvWyktrIL8DO/+UGvMbv7cPd/Xogpbs7pgVw8y9ldO6AAMmg8+ijENl/c7Fb1MfKM7uG3LMwAr0dVVKyM+mbkoX2k5L7lsROQr0Z9gGSpu7xrnZOa58+/pIhd2Xk/DFPpa5+TKbWodbsSZPRN8z0RY5x59jdzSclXlEyN9mEZdmOiKTsOP6A7vQxfSya9jg5" "N81dfNNvP7HnWejMMsKyIMrXptxOhIBuEYH67JDe98QgX14oHvGM2Uz53if/SW8MF09rYh9sp4ZsaWLIg6T343JzlbtrsGRGCDJ9JPpxRWZimtz+Up/BlKzT6sCCrBihb/Bi3pZiEBB4Ui/vruL5RCQIDAQAB;n=2048,1452627113,1468351913" (532)
        0x0000:  4500 024a 4265 0000 7806 da2d 0808 0808  E..JBe..x..-....
        0x0010:  0a0a 0a02 0035 ab5a 9758 36b5 46d3 fc35  .....5.Z.X6.F..5
        0x0020:  8018 00ec b5fc 0000 0101 080a 9ff4 9128  ...............(
        0x0030:  552d 1be4 0214 30e6 8180 0001 0001 0000  U-....0.........
        0x0040:  0001 0973 656c 6563 746f 7231 0a5f 646f  ...selector1._do
        0x0050:  6d61 696e 6b65 7908 6f75 7462 6f75 6e64  mainkey.outbound
        0x0060:  0a70 726f 7465 6374 696f 6e07 6f75 746c  .protection.outl
        0x0070:  6f6f 6b03 636f 6d00 0010 0001 c00c 0010  ook.com.........
        0x0080:  0001 0000 014a 01b7 fb76 3d44 4b49 4d31  .....J...v=DKIM1
        0x0090:  3b6b 3d72 7361 3b70 3d4d 4949 4249 6a41  ;k=rsa;p=MIIBIjA
        0x00a0:  4e42 676b 7168 6b69 4739 7730 4241 5145  NBgkqhkiG9w0BAQE
        0x00b0:  4641 414f 4341 5138 414d 4949 4243 674b  FAAOCAQ8AMIIBCgK
        0x00c0:  4341 5145 4176 5779 6b74 7249 4c38 444f  CAQEAvWyktrIL8DO
        0x00d0:  2f2b 5547 764d 6276 3763 5064 2f58 6f67  /+UGvMbv7cPd/Xog
        0x00e0:  7062 7337 7067 5677 3879 396c 644f 3641  pbs7pgVw8y9ldO6A
        0x00f0:  414d 6d67 382b 696a 454e 6c2f 6337 4662  AMmg8+ijENl/c7Fb
        0x0100:  314d 664b 4d37 7547 334c 4d77 4172 3064  1MfKM7uG3LMwAr0d
        0x0110:  5656 4b79 4d2b 6d62 6b6f 5832 6b35 4c37  VVKyM+mbkoX2k5L7
        0x0120:  6c73 524f 5172 305a 3967 4753 7075 3778  lsROQr0Z9gGSpu7x
        0x0130:  726e 5a4f 6135 382b 2f70 4968 6432 586b  rnZOa58+/pIhd2Xk
        0x0140:  2f44 4650 7061 352b 544b 6257 6f64 6273  /DFPpa5+TKbWodbs
        0x0150:  535a 5052 4e38 7a30 5259 3578 3539 6a64  SZPRN8z0RY5x59jd
        0x0160:  7a53 636c 586c 4579 4e39 6d45 5a64 6d4f  zSclXlEyN9mEZdmO
        0x0170:  694b 5473 4f50 3641 3776 5178 6653 7961  iKTsOP6A7vQxfSya
        0x0180:  396a 6735 ba4e 3831 6466 4e4e 7650 3748  9jg5.N81dfNNvP7H
        0x0190:  6e57 656a 4d4d 734b 7949 4d72 5870 7478  nWejMMsKyIMrXptx
        0x01a0:  4f68 4942 7545 5948 3637 4a44 6539 3851  OhIBuEYH67JDe98Q
        0x01b0:  6758 3134 6f48 7647 4d32 557a 3533 6966  gX14oHvGM2Uz53if
        0x01c0:  2f53 5738 4d46 3039 7259 6839 7370 345a  /SW8MF09rYh9sp4Z
        0x01d0:  7361 574c 4967 3654 3334 334a 7a6c 6274  saWLIg6T343Jzlbt
        0x01e0:  7273 4752 4743 444a 394a 5070 7852 575a  rsGRGCDJ9JPpxRWZ
        0x01f0:  696d 747a 2b55 702f 426c 4b7a 5436 7343  imtz+Up/BlKzT6sC
        0x0200:  4372 4269 6862 2f42 6933 705a 6945 4242  CrBihb/Bi3pZiEBB
        0x0210:  3455 692f 7672 754c 3552 4351 4944 4151  4Ui/vruL5RCQIDAQ
        0x0220:  4142 3b6e 3d32 3034 382c 3134 3532 3632  AB;n=2048,145262
        0x0230:  3731 3133 2c31 3436 3833 3531 3931 3300  7113,1468351913.
        0x0240:  0029 0200 0000 0000 0000                 .)........
02:13:09.316096 IP 10.10.10.2.43866 > 8.8.8.8.53: Flags [P.], seq 1:84, ack 1, win 216, options [nop,nop,TS val 1429020183 ecr 2683605095], length 8312518+ [1au] TXT? selector1._domainkey.outbound.protection.outlook.com. (81)
        0x0000:  4500 0087 00b0 4000 4006 15a6 0a0a 0a02  E.....@.@.......
        0x0010:  0808 0808 ab5a 0035 46d3 fbe2 9758 36b5  .....Z.5F....X6.
        0x0020:  8018 00d8 3498 0000 0101 080a 552d 1e17  ....4.......U-..
        0x0030:  9ff4 9067 0051 30e6 0100 0001 0000 0000  ...g.Q0.........
        0x0040:  0001 0973 656c 6563 746f 7231 0a5f 646f  ...selector1._do
        0x0050:  6d61 696e 6b65 7908 6f75 7462 6f75 6e64  mainkey.outbound
        0x0060:  0a70 726f 7465 6374 696f 6e07 6f75 746c  .protection.outl
        0x0070:  6f6f 6b03 636f 6d00 0010 0001 0000 2902  ook.com.......).
        0x0080:  0000 0000 0000 00                        .......
02:13:09.317080 IP 8.8.8.8.53 > 10.10.10.2.43866: Flags [.], ack 84, win 236, options [nop,nop,TS val 2683605845 ecr 1429020183,nop,nop,sack 1 {1:84}], length 0
        0x0000:  4500 0040 43e0 0000 7806 dabc 0808 0808  E..@C...x.......
        0x0010:  0a0a 0a02 0035 ab5a 9758 38cb 46d3 fc35  .....5.Z.X8.F..5
        0x0020:  b010 00ec 3094 0000 0101 080a 9ff4 9355  ....0..........U
        0x0030:  552d 1e17 0101 050a 46d3 fbe2 46d3 fc35  U-......F...F..5
02:13:09.321070 IP 8.8.8.8.53 > 10.10.10.2.43866: Flags [P.], seq 1:535, ack 84, win 236, options [nop,nop,TS val 2683605849 ecr 1429020183], length 53412518 1/0/1 TXT "v=DKIM1;k=rsa;p=MIIBIjANBgkqhkiG9w0BAQEFAAOCAQ8AMIIBCgKCAQEAvWyktrIL8DO/+UGvMbv7cPd/Xogpbs7pgVw8y9ldO6AAMmg8+ijENl/c7Fb1MfKM7uG3LMwAr0dVVKyM+mbkoX2k5L7lsROQr0Z9gGSpu7xrnZOa58+/pIhd2Xk/DFPpa5+TKbWodbsSZPRN8z0RY5x59jdzSclXlEyN9mEZdmOiKTsOP6A7vQxfSya9jg5" "N81dfNNvP7HnWejMMsKyIMrXptxOhIBuEYH67JDe98QgX14oHvGM2Uz53if/SW8MF09rYh9sp4ZsaWLIg6T343JzlbtrsGRGCDJ9JPpxRWZimtz+Up/BlKzT6sCCrBihb/Bi3pZiEBB4Ui/vruL5RCQIDAQAB;n=2048,1452627113,1468351913" (532)
        0x0000:  4500 024a 43e3 0000 7806 d8af 0808 0808  E..JC...x.......
        0x0010:  0a0a 0a02 0035 ab5a 9758 36b5 46d3 fc35  .....5.Z.X6.F..5
        0x0020:  8018 00ec b198 0000 0101 080a 9ff4 9359  ...............Y
        0x0030:  552d 1e17 0214 30e6 8180 0001 0001 0000  U-....0.........
        0x0040:  0001 0973 656c 6563 746f 7231 0a5f 646f  ...selector1._do
        0x0050:  6d61 696e 6b65 7908 6f75 7462 6f75 6e64  mainkey.outbound
        0x0060:  0a70 726f 7465 6374 696f 6e07 6f75 746c  .protection.outl
        0x0070:  6f6f 6b03 636f 6d00 0010 0001 c00c 0010  ook.com.........
        0x0080:  0001 0000 014a 01b7 fb76 3d44 4b49 4d31  .....J...v=DKIM1
        0x0090:  3b6b 3d72 7361 3b70 3d4d 4949 4249 6a41  ;k=rsa;p=MIIBIjA
        0x00a0:  4e42 676b 7168 6b69 4739 7730 4241 5145  NBgkqhkiG9w0BAQE
        0x00b0:  4641 414f 4341 5138 414d 4949 4243 674b  FAAOCAQ8AMIIBCgK
        0x00c0:  4341 5145 4176 5779 6b74 7249 4c38 444f  CAQEAvWyktrIL8DO
        0x00d0:  2f2b 5547 764d 6276 3763 5064 2f58 6f67  /+UGvMbv7cPd/Xog
        0x00e0:  7062 7337 7067 5677 3879 396c 644f 3641  pbs7pgVw8y9ldO6A
        0x00f0:  414d 6d67 382b 696a 454e 6c2f 6337 4662  AMmg8+ijENl/c7Fb
        0x0100:  314d 664b 4d37 7547 334c 4d77 4172 3064  1MfKM7uG3LMwAr0d
        0x0110:  5656 4b79 4d2b 6d62 6b6f 5832 6b35 4c37  VVKyM+mbkoX2k5L7
        0x0120:  6c73 524f 5172 305a 3967 4753 7075 3778  lsROQr0Z9gGSpu7x
        0x0130:  726e 5a4f 6135 382b 2f70 4968 6432 586b  rnZOa58+/pIhd2Xk
        0x0140:  2f44 4650 7061 352b 544b 6257 6f64 6273  /DFPpa5+TKbWodbs
        0x0150:  535a 5052 4e38 7a30 5259 3578 3539 6a64  SZPRN8z0RY5x59jd
        0x0160:  7a53 636c 586c 4579 4e39 6d45 5a64 6d4f  zSclXlEyN9mEZdmO
        0x0170:  694b 5473 4f50 3641 3776 5178 6653 7961  iKTsOP6A7vQxfSya
        0x0180:  396a 6735 ba4e 3831 6466 4e4e 7650 3748  9jg5.N81dfNNvP7H
        0x0190:  6e57 656a 4d4d 734b 7949 4d72 5870 7478  nWejMMsKyIMrXptx
        0x01a0:  4f68 4942 7545 5948 3637 4a44 6539 3851  OhIBuEYH67JDe98Q
        0x01b0:  6758 3134 6f48 7647 4d32 557a 3533 6966  gX14oHvGM2Uz53if
        0x01c0:  2f53 5738 4d46 3039 7259 6839 7370 345a  /SW8MF09rYh9sp4Z
        0x01d0:  7361 574c 4967 3654 3334 334a 7a6c 6274  saWLIg6T343Jzlbt
        0x01e0:  7273 4752 4743 444a 394a 5070 7852 575a  rsGRGCDJ9JPpxRWZ
        0x01f0:  696d 747a 2b55 702f 426c 4b7a 5436 7343  imtz+Up/BlKzT6sC
        0x0200:  4372 4269 6862 2f42 6933 705a 6945 4242  CrBihb/Bi3pZiEBB
        0x0210:  3455 692f 7672 754c 3552 4351 4944 4151  4Ui/vruL5RCQIDAQ
        0x0220:  4142 3b6e 3d32 3034 382c 3134 3532 3632  AB;n=2048,145262
        0x0230:  3731 3133 2c31 3436 3833 3531 3931 3300  7113,1468351913.
        0x0240:  0029 0200 0000 0000 0000                 .)........
02:13:09.508187 IP 10.10.10.2.43866 > 8.8.8.8.53: Flags [.], ack 535, win 224, options [nop,nop,TS val 1429020375 ecr 2683605849], length 0
        0x0000:  4500 0034 00b1 4000 4006 15f8 0a0a 0a02  E..4..@.@.......
        0x0010:  0808 0808 ab5a 0035 46d3 fc35 9758 38cb  .....Z.5F..5.X8.
        0x0020:  8010 00e0 ebb2 0000 0101 080a 552d 1ed7  ............U-..
        0x0030:  9ff4 9359                                ...Y
02:13:09.508220 IP 10.10.10.2.43866 > 8.8.8.8.53: Flags [F.], seq 84, ack 535, win 224, options [nop,nop,TS val 1429020375 ecr 2683605849], length 0
        0x0000:  4500 0034 00b2 4000 4006 15f7 0a0a 0a02  E..4..@.@.......
        0x0010:  0808 0808 ab5a 0035 46d3 fc35 9758 38cb  .....Z.5F..5.X8.
        0x0020:  8011 00e0 ebb1 0000 0101 080a 552d 1ed7  ............U-..
        0x0030:  9ff4 9359                                ...Y
02:13:09.509008 IP 8.8.8.8.53 > 10.10.10.2.43866: Flags [F.], seq 535, ack 85, win 236, options [nop,nop,TS val 2683606037 ecr 1429020375], length 0
        0x0000:  4500 0034 4468 0000 7806 da40 0808 0808  E..4Dh..x..@....
        0x0010:  0a0a 0a02 0035 ab5a 9758 38cb 46d3 fc36  .....5.Z.X8.F..6
        0x0020:  8011 00ec eae8 0000 0101 080a 9ff4 9415  ................
        0x0030:  552d 1ed7                                U-..
02:13:09.695290 IP 10.10.10.2.43866 > 8.8.8.8.53: Flags [.], ack 536, win 224, options [nop,nop,TS val 1429020563 ecr 2683606037], length 0
        0x0000:  4500 0034 00b3 4000 4006 15f6 0a0a 0a02  E..4..@.@.......
        0x0010:  0808 0808 ab5a 0035 46d3 fc36 9758 38cc  .....Z.5F..6.X8.
        0x0020:  8010 00e0 ea38 0000 0101 080a 552d 1f93  .....8......U-..
        0x0030:  9ff4 9415                                ....
```

**Comment by baudehlo** [comment]
Does your Haraka server have a local caching resolver? I recommend that on
all email servers, and it can help resolve issues like this (sometimes).

**Comment by zhanleewo** [comment]
This is a network issue. I think i should do some research on network.

Thank you.
